{
  "schemaVersion": 1,
  "minimumIOS": 18,
  "id": "00000000-0000-4000-8000-000000000005",
  "name": "Soft Light",
  "description": "Warm paper and clear ink.",
  "background": "#EAE8E1",
  "key": "#FFFFFF",
  "primary": "#1D292B",
  "secondary": "#485E61",
  "accent": "#17695D",
  "pressed": "#B9DCD4",
  "border": "#C4CECA",
  "cornerRadius": 8,
  "spacing": 5,
  "padding": 6,
  "borderWidth": 0.5,
  "font": "rounded",
  "appearance": "light",
  "layout": "qwerty",
  "soundPack": "tactile"
}
