{
  "schemaVersion": 1,
  "minimumIOS": 18,
  "id": "00000000-0000-4000-8000-000000000004",
  "name": "Midnight",
  "description": "Deep blue for late ideas.",
  "background": "#101426",
  "key": "#262D4C",
  "primary": "#ECEEFF",
  "secondary": "#ABB4D9",
  "accent": "#A5B4FF",
  "pressed": "#4A5A65",
  "border": "#4C5D69",
  "cornerRadius": 8,
  "spacing": 5,
  "padding": 6,
  "borderWidth": 0.5,
  "font": "rounded",
  "appearance": "dark",
  "layout": "qwerty",
  "soundPack": "tactile"
}
