{
  "schemaVersion": 1,
  "minimumIOS": 18,
  "id": "00000000-0000-4000-8000-000000000001",
  "name": "Dark Glass",
  "description": "Quiet contrast. A hint of mint.",
  "background": "#121B22",
  "key": "#29353F",
  "primary": "#F0F6F7",
  "secondary": "#9DAEBB",
  "accent": "#83E5CE",
  "pressed": "#4A5A65",
  "border": "#4C5D69",
  "cornerRadius": 8,
  "spacing": 5,
  "padding": 6,
  "borderWidth": 0.5,
  "font": "rounded",
  "appearance": "dark",
  "layout": "qwerty",
  "soundPack": "tactile"
}
