{
  "schemaVersion": 1,
  "minimumIOS": 18,
  "id": "00000000-0000-4000-8000-000000000006",
  "name": "Futuristic",
  "description": "A measured electric violet.",
  "background": "#1A1229",
  "key": "#362849",
  "primary": "#F6EDFF",
  "secondary": "#C5AEDB",
  "accent": "#D4A5FA",
  "pressed": "#4A5A65",
  "border": "#4C5D69",
  "cornerRadius": 8,
  "spacing": 5,
  "padding": 6,
  "borderWidth": 0.5,
  "font": "rounded",
  "appearance": "dark",
  "layout": "qwerty",
  "soundPack": "tactile"
}
