{
  "schemaVersion": 1,
  "minimumIOS": 18,
  "id": "00000000-0000-4000-8000-000000000003",
  "name": "Retro Tech",
  "description": "Phosphor green, reimagined.",
  "background": "#101D15",
  "key": "#1C3424",
  "primary": "#C8F5CC",
  "secondary": "#9DBBA1",
  "accent": "#9BE378",
  "pressed": "#4A5A65",
  "border": "#4C5D69",
  "cornerRadius": 8,
  "spacing": 5,
  "padding": 6,
  "borderWidth": 0.5,
  "font": "rounded",
  "appearance": "dark",
  "layout": "qwerty",
  "soundPack": "tactile"
}
